,Applications,Categories,Company,EmployType,ExpiryDate,Location,PostedDate,Requirements,SalaryHigh,SalaryLow,SalaryRate,Seniority,Title
673,5,"Design, Engineering",LEADING ENERGY PTE. LTD.,Full Time,Closing on 23 Feb 2019,West,Posted 24 Jan 2019,15+ years’ experience with onshore/offshore oil & gas structures with a Bachelor or diploma Degree in Civil/Structural Engineering. Familiar with international/American codes and standards.,"$8,500","$6,500",Monthly,Senior Executive,senior instrumentation designer
674,11,Sciences / Laboratory / R&D,PSB ACADEMY PTE. LTD.,Full Time,Closing on 23 Feb 2019,Central,Posted 24 Jan 2019,"Bachelor of Science in related discipline.
Entry level candidates will be considered
1 – 2 years of relevant working experience in a research laboratory or teaching laboratory would be advantageous
Prior teaching/ instructional experience would be advantageous
Willing to work at night (weekdays) and Saturdays as well as occasional Sundays.
We regret that only shortlisted candidates will be notified.",,,,Junior Executive,"Laboratory Technologist, School of LIfe and Physical Sciences"
675,1,Information Technology,UNISOFT INFOTECH PTE LTD,Permanent,Closing on 23 Feb 2019,Central,Posted 24 Jan 2019,"Experience in end-to-end product management in web and mobile app software technologies.
Experience in software development and developing numerous web-based applications.
Knowledgeable across multiple functional areas such as product management, engineering, UI, sales, customer support, finance or marketing.
Minimum 10 years of experience in web and mobile app software technologies.
Knowledge of technology, workflow systems, transactional systems, business requirement, software development life cycle, integration and the ecosystem involved, standards, APIs protocols
Strong knowledge in both RDBMS and NoSQL database platforms. Hands-on experience with MySQL, PostgreSQL, BigQuery is an advantage.
Have minimum 7 years hands-on programming experience, Knowledge of Java (on Apache Tomcat), Python, NodeJS or PHP will be a plus.
Experience managing external vendors/partners
Those with experience with Scrum or any other agile methodologies is preferred
Have worked in developing scalable, enterprise grade software solutions, catering millions of users
Experience with AWS / GCP and its suite of PAAS solutions is a big plus point.
Analytical and able to confidently make informed decisions when necessary
Excellent communication and interpersonal skills
 ","$12,000","$9,000",Monthly,Senior Management,Product Head
676,16,Manufacturing,ASM FRONT-END MANUFACTURING SINGAPORE PTE. LTD.,"Permanent, Full Time",Closing on 23 Feb 2019,North,Posted 24 Jan 2019,"•    Minimum 5 years of purchasing, planning or supply chain management experience
•    Strong sense of responsibility and results driven
•    Experience in SAP system and proficient in MS Excel, Word, Powerpoint and Outlook
•    Strong and concise written and verbal communication skills
•    Good analytical and negotiation skills
•    Knowledge of supply chain and materials flow concepts
 ","$5,000","$3,000",Monthly,Executive,Buyer
677,0,Sciences / Laboratory / R&D,A*STAR RESEARCH ENTITIES,"Contract, Full Time",Closing on 23 Feb 2019,West,Posted 24 Jan 2019,"Bachelor in Engineering or Computer Science
5 years experience with automation system
5-10 years experience in IPv4 and IPv6 networking, L2 and L3 protocols including VLAN and relevant security/firewalling
Strong leadership skills and the ability to work with others to achieve project goals
A desire to learn new technologies, and help others to develop their knowledge to work together effectively
The above eligibility criteria are not exhaustive. A*STAR may include additional selection criteria based on its prevailing recruitment policies. These policies may be amended from time to time without notice. We regret that only shortlisted candidates will be notified.","$6,800","$3,400",Monthly,Executive,Senior Research Engineer (ARTC)
678,3,"Logistics / Supply Chain, Others",APL CO. PTE LTD,Permanent,Closing on 23 Feb 2019,Central,Posted 24 Jan 2019,"JOB REQUIREMENTS
Education :
Diploma/Degree Qualifications in relevant discipline
Professional qualifications / Higher Nitec with relevant experience will also be considered
Experience :
Requires at least 5 years or more of strong supervisory experience in container/reefer operations environment and/or related industry.
Previous experience as a reefer technician or supervisor would be expected as a natural progression to this position.
Require an in-depth, comprehensive understanding of reefer operations (technical requirements, datalog review, shipment of sensitive reefers etc).
Skills Set
Computer skills with a sound understanding of modern reefer operation (CARRIER, STARCOOL, THERMOKING, DAIKIN).
Ability to work under pressure, anticipates and evaluate issues
Resolve problems as they happen in order to meet volume and revenue targets plus avoid claims.
An active part of team and ensure cooperation/support from employees and vendors in all areas of reefer operations in order to achieve objectives of the business.
Requires advanced level of verbal and written communications skills in English.
Team-player.
Awareness and ability to work with constant care.","$6,000","$4,000",Monthly,Senior Executive,"Specialist / Senior Specialist, Reefer Process"
679,0,"Logistics / Supply Chain, Others",APL CO. PTE LTD,Permanent,Closing on 23 Feb 2019,Central,Posted 24 Jan 2019,"JOB REQUIREMENTS
Education :
Diploma/Degree Qualifications in relevant discipline
Professional qualifications / Higher Nitec with relevant experience will also be considered
Experience :
Requires at least 5 years or more of strong supervisory experience in container/reefer operations environment and/or related industry.
Previous experience as a reefer technician or supervisor would be expected as a natural progression to this position.
Require an in-depth, comprehensive understanding of reefer operations (technical requirements, datalog review, shipment of sensitive reefers etc).
Skills Set
Computer skills with a sound understanding of modern reefer operation (CARRIER, STARCOOL, THERMOKING, DAIKIN).
Ability to work under pressure, anticipates and evaluate issues
Resolve problems as they happen in order to meet volume and revenue targets plus avoid claims.
An active part of team and ensure cooperation/support from employees and vendors in all areas of reefer operations in order to achieve objectives of the business.
Requires advanced level of verbal and written communications skills in English.
Team-player.
Awareness and ability to work with constant care.","$4,500","$3,000",Monthly,Senior Executive,"Specialist / Senior Specialist, Reefer Process"
680,0,Sciences / Laboratory / R&D,NANYANG TECHNOLOGICAL UNIVERSITY,Contract,Closing on 23 Feb 2019,Central,Posted 24 Jan 2019,"Skills and qualifications:
• PhD or equivalent experience in optics, photonics, physics, electrical engineering or related field.
• Experience in design, optimisation, building, prototyping and testing of optical microscopes is essential
• Experience with electronics design and/or use is preferred
• Experience with various types of scanners (MEMS, galvo, etc) is essential
• Knowledge of optical design programs (Zemax, Code V) and 3D design programs (SolidWorks, Autocad) is preferred
• Programming knowledge is essential. Experience in C++, Phython, Matlab and/or Java is strongly desirable.
• Strong command of English (written and spoken) is essential.
  The position is based at the Nanyang Technological University in Singapore.
  For further information, or to apply, please contact one of the following:
Peter Török (peter.torok@ntu.edu.sg)
Suresh Jesuthasan (sureshj@ntu.edu.sg).","$8,000","$4,000",Monthly,Professional,Research Fellow
681,3,"Others, Professional Services",GERSON LEHRMAN GROUP SINGAPORE PTE. LTD.,"Permanent, Full Time",Closing on 23 Feb 2019,Central,Posted 24 Jan 2019,"Candidate Criteria:
Experience in channel marketing/management or business development at technology company (e.g. tech start-ups, SMEs)
Excellent written and oral communication skills
Ability to navigate through ambiguity and work with little or no guidance
Analytical and problem-solving skills with the ability to grasp complex technical product aspects and develop data-driven recommendations and action plans
About GLG / Gerson Lehrman Group
GLG is the world’s leading platform connecting professionals with expertise. We pair businesses and nonprofits in every sector with the largest network of experts from around the globe to drive smarter, faster decisions and help make the world work better. Our clients rely on GLG’s 650,000+ member-experts and almost 2,000 employees to provide 24/7 insight and exceptional service within our rigorous compliance framework. We bring the power of insight to every great professional decision. 
To learn more, visit www.GLG.it.
Notes: GLG does not allow employees to trade public equities or debt.  All prospective new hires are required to undergo a background check.
 ","$95,000","$55,000",Annually,Manager,Partnership Manager
682,4,Engineering,SUEZ WATER TECHNOLOGIES & SOLUTIONS SINGAPORE PTE. LTD.,Permanent,Closing on 23 Feb 2019,South,Posted 24 Jan 2019,"• Advanced degree, or Bachelors with significant relevant and demonstrated experience, in
Chemical Engineering (preferred), with 7-10 years of experience in related fields.
• Experience with chemical process development and flow sheet synthesis for water and
wastewater treatment (early to mid-stage readiness levels)
• Good understanding of heat transfer processes, slurry management, separations...broad range
of chemical unit operations
• Hands-on experience with process equipment design, process flow, and/or operations...lab,
pilot, and commercialization
• Independent, motivated self-starter with the personal initiative to help shape and lead
important Growth Program platforms.
• Ability to collaborate and influence within multi-functional local and global teams...routinely
collaborating with teams in NAM
• Strong task, project management skills, including recording, statistical analysis and
maintenance of data.
• Good command of English, and technical communication skills (oral and written).
• Strong adherence to Environmental, Health, and Safety (EHS) practices.","$13,000","$11,000",Monthly,Manager,Senior Process Engineer
683,20,Logistics / Supply Chain,RANDSTAD PTE. LIMITED,Full Time,Closing on 23 Feb 2019,East,Posted 24 Jan 2019,"skills & experience required
To be successful in this position, you must have the ability to demonstrate or possess:
Degree/Masters  in Logistic & Supply Chain / Industrial Engineering
Minimum 2 years of relevant experience in operations, logistics and data analytical processes in manufacturing/semiconductor industry
Excellent analytical and project management skills
Knowledge in Databases, Spotfire or other internal analysis software will be a plus
Willing to work in the East
how to apply
To apply online, please click on the ‘apply’ function below. Alternatively, please contact eileen at eileen.goh(@)randstad.com.sg
Please indicate your availability, expected salary, and reason for leaving your current job in your CV.
EA: 94C3609 / R1880230","$5,000","$3,800",Monthly,Junior Executive,Supply Chain Analyst (Manufacturing / Semiconductor)
684,8,Information Technology,HP PPS SINGAPORE (SALES) PTE. LTD.,"Permanent, Full Time",Closing on 23 Feb 2019,"South, Central",Posted 24 Jan 2019,"Are you a high-performer? We are looking for an individual with:
University or Bachelor's Degree in related field or discipline
12-15 years of related experience, including minimally 5-7 years of customer facing experience (in managed services)
Capability in solutioning
The understanding on how the deal cycle works
The knowledge in Information Technology Infrastructure Library (ITIL), End User Workspace Services (EUWS), and IT service management (ITSM)
HP is a Human Capital Partner – we commit to human capital development and adopting progressive workplace practices in Singapore.","$10,000","$6,000",Monthly,"Manager, Professional",Transition Manager - PC Services
685,2,Manufacturing,MITSUBISHI CHEMICAL INFONICS PTE LTD,Full Time,Closing on 23 Feb 2019,West,Posted 24 Jan 2019,"Degree in Mechanical, Electrical,  Electronics or Mechatronics Engineering with 1 to 2 years' working experience in a high volume manufacturing environment.
Knoweldge in factory automation and failure analysis will be an added advantage.
Demonstrate discipline in execution of task.
Demonstrate flexibility/adaptability to frequent change.","$3,800","$2,900",Monthly,Executive,PRODUCTION ENGINEERS
686,8,Engineering,DOVRE GROUP (SINGAPORE) PTE. LTD.,"Contract, Full Time",Closing on 23 Feb 2019,West,Posted 24 Jan 2019,"SKILLS AND QUALIFICATIONS
BS degree in Electrical Engineering
Experience in wireless technology application
7+ years experience in multiple assignments in engineering, construction, and project management and controls activities
Broad range of experience and skills through multiple function & project assignments (Multi-discipline skill set)
Broad knowledge of design standards, specifications & work processes
Strong leadership, influencing & interpersonal skills
Strong organizational, coordination, planning & interface skills
Ability to adapt to tight deadlines, heavy workloads & frequent changes in priorities
Excellent communication skills & ability to read, write & speak fluent English
Proficient in MS Office suite of software programs
This is a job level 1 position: 1 to 10 years of related experience is required","$7,000","$5,000",Monthly,Professional,Project Engineer I
687,6,Engineering,PERX TECHNOLOGIES PTE. LTD.,Full Time,Closing on 23 Feb 2019,Islandwide,Posted 24 Jan 2019,"  BA / BS in related field, preferably business or computer science related; MBA preferred.
8+ years of relevant experience in product management and/or product marketing with a proven track record of delivering SaaS technology platforms, preferably focused on marketing and/or advertising objectives.
Proven success in taking products from concept to commercialization, with a keen eye on controlling costs, increasing revenues, and growing margins.
Extensive experience writing business and product requirements for software, technology, data, and Internet products.
Experience with marketing technology platforms, SaaS, and/or loyalty marketing products and services.
Excellent communication skills, both written and verbal, with the ability to interact with cross-functional teams at all levels.
Experience, comfort and aptitude interacting with senior management both internally and with clients and partners.
Must be self-motivated, resourceful, diligent, and adaptive.
Innovative thinker with aptitude in capitalizing upon market disruption to build forward-looking products and platforms to clients and partners.
Superior analytical and quantitative skills with a strong understanding of data-driven decisioning and exhibited experience working with Data Science and statistical analysts.
Ability to monitor and succinctly report to management on key performance indicators, and deep expertise working with marketing metrics and measurement methodology.
Comfortable working with technical and Internet related products, data, and inputs.
Strong organizational and project management skills.
A natural leader with experience managing people and constituents from various business units, selling ideas, speaking in public settings, and deep expertise in marketing or advertising technology.
Available for periodic travel.",,,,Senior Management,"Director, Product Management"
688,0,Repair and Maintenance,THE SUPREME HR ADVISORY PTE. LTD.,Full Time,Closing on 23 Feb 2019,Central,Posted 24 Jan 2019,"Dylan Then Reg No: R1878687
The Supreme HR Advisory Pte Ltd EA No: 14C7279
 ","$2,400","$2,000",Monthly,Junior Executive,Aerospace Technician [CAAS / Overhaul / Pneumatic]
689,1,Telecommunications,WHALE CLOUD SINGAPORE PTE. LTD.,Full Time,Closing on 23 Feb 2019,Central,Posted 24 Jan 2019,"Requirements
Degree in computer science or equivalent.
Have less than three years of working experience
Self-motivated, self-discipline and learning attitude
Good analytical logically
Have good communication skills
Able to speak Mandarin and English
Only Singaporeans","$3,400","$3,000",Monthly,Fresh/entry level,Software Engineer
690,2,Sales / Retail,ANIXTER SINGAPORE PTE LTD,Permanent,Closing on 23 Feb 2019,West,Posted 24 Jan 2019,"Diploma in IT, Telecommunications, Electrical Engineering, Business or equivalent qualifications
At least 1-3 years of sales experience with a track record of exceeding their objectives
Experience on inside sales, telesales and/or telemarketing in the IT industry is essential
Good knowledge of electrical wiring, telecommunications or security products will be an added advantage
Good communication skills with excellent telephone etiquette","$4,500","$2,800",Monthly,Executive,inside Sales Executive
691,3,Information Technology,CAPGEMINI SINGAPORE PTE. LTD.,Permanent,Closing on 23 Feb 2019,Central,Posted 24 Jan 2019,Please see the requirements and apply via the following link: https://www.hackertrail.com/capgemini ,"$8,500","$4,500",Monthly,Professional,"Developers (Fullstack, Frontend, Python, RPA)"
692,8,Engineering,DOVRE GROUP (SINGAPORE) PTE. LTD.,"Contract, Full Time",Closing on 23 Feb 2019,West,Posted 24 Jan 2019,"BS degree in engineering field
5+ years experience in multiple assignments in engineering, construction, and project management and controls activities
Marine Berth Cranes Construction experience preferred
Broad range of experience and skills through multiple function & project assignments (Multi-discipline skill set)
Broad knowledge of design standards, specifications & work processes
Strong leadership, influencing & interpersonal skills
Strong organizational, coordination, planning & interface skills
Ability to adapt to tight deadlines, heavy workloads & frequent changes in priorities
Excellent communication skills & ability to read, write & speak fluent English
Proficient in MS Office suite of software programs
This is a job level 1 position: 1 to 10 years of related experience is required","$7,000","$5,000",Monthly,Professional,Project Engineer I
693,0,Sciences / Laboratory / R&D,CATALYST RECOVERY SINGAPORE PTE. LTD.,Full Time,Closing on 23 Feb 2019,West,Posted 24 Jan 2019,"Pre-requisites:
Degree or Diploma in Chemical Engineering or Chemistry or a related field.
At least 3 years laboratory hands on experience preferably in a pilot plant testing
Proficient in Microsoft Office applications. 
Analytical, process and problem solving skills
Knowledge of general laboratory practices
Research skills
Ability to perform tests in GC analyzer, evaluate their validity, maintain and compile data for reports with confidentiality.
Able to maintain and troubleshoot research equipment with knowledge in instrumentation and PLC application.
  Note: 
Pilot plant facility is running on 24 hours on 3 shift operations, 7 days a week.  If required, you may have to work
afternoon or night shift to cover the operation.
  Salary:
An attractive salary package will be offered to the successful candidate 
Please indicate your current and expected salary in your resume
  Working:
Working Days:     5 Day Week
Working Hours:    8.30 am to 5.15 pm
  Transport
Transport is provided at:
Pick Up Point:      @ 8 am - Chinese Garden MRT or Jurong West Ave 4 (bus stop in front Blk 641)
Drop Off Point:     Pasir Laba Camp Bus Stop or Jurong East MRT
                                             Please send your application with full resume to:
  email:   maggiecheong@porocel.com
(Only short-listed candidates will be notified)
 ","$3,500","$2,000",Monthly,Executive,Asst / Test Engineer
694,21,Banking and Finance,MAKO APAC PTE. LTD.,"Permanent, Full Time",Closing on 14 Feb 2019,Central,Posted 24 Jan 2019,"Main Responsibilities
The successful candidate will:
Proactively monitor and analyse risk across the firm
Work closely with traders, quants, developers and operational staff across the company  in multiple time zones
Develop tools and metrics to improve the current processes
Identify and track key risks, escalating potential risk issues to senior management on a timely basis
Understand and analyse the key market drivers and how they affect the firms positons
Develop risk frameworks for new trading desks
Person Specification
The trading environment changes rapidly so the successful candidate will need to be flexible, energetic and fast-thinking with the drive to follow market moves and position changes
Has front office experience or experience working directly with traders and trading teams as well as quants and developers
The right person for the role will be highly self-motivated and capable of thriving in a global team
The successful applicant will be able to contribute to the desk from day one and be able to maintain risk oversight across the Asian business with minimal supervision from other risk teams.
The ability to remain focused, methodical and firm in dealings with front office teams especially during high volatility market events is also a key requirement
Skills
Strong understanding of option Greeks and position sensitivities
Have practical experience on exchange and clearer margin management and replication
High proficiency in Excel/VBA, Bloomberg Terminal usage and Python programming in a Linux/Unix environment
Developing interfaces for live data visualisation in a multi-exchange, multi-network distributed system
Strong work ethic and the ability to multi-task across both team oriented and individual projects
Confident problem solver with proven analytical ability who is comfortable analysing large, varied and distributed data sets
Excellent communication skills across with a strong attention to detail
The ideal candidate will have strong quantitative and analytical skills, solid interpersonal skills as well as the ability to quickly learn and adapt to new concepts
Qualifications
University / college educated with minimum of a 2.1 Bachelor’s degree, or equivalent
Studies to have focused on numerical subjects, (e.g. Engineering, Sciences, Maths)
Travel
The Candidate will be based in Singapore and will liaise with all offices worldwide. Some travel may be required.","$90,000","$80,000",Annually,Executive,Risk Analyst
695,8,"Customer Service, Logistics / Supply Chain, Marketing / Public Relations , Purchasing / Merchandising, Sales / Retail",OAKTREE CONSULTING,"Permanent, Full Time",Closing on 23 Feb 2019,South,Posted 24 Jan 2019,"  Please submit resumes to john@oaktree.com.sg with the following details in MS Word format:
  - Position applying for
- Current remuneration
- Expected remuneration
- Notice period 
    John Goh Meng Chye 
EA License No : 06C4642
EA Reg No : R1102621
    We regret that only shortlisted candidates will be notified.
 ",,,,Manager,Regional Sales and Marketing Manager(Electrical Components)
