,Applications,Categories,Company,EmployType,ExpiryDate,Location,PostedDate,Requirements,SalaryHigh,SalaryLow,SalaryRate,Seniority,Title
236,0,Sciences / Laboratory / R&D,NATIONAL UNIVERSITY OF SINGAPORE,"Contract, Full Time",Closing on 12 Feb 2019,South,Posted 28 Jan 2019,"PhD degree in Electrical Engineering
Have learned MEMS or Photonics related courses for one semester at post-graduate level and graduate level with earned score of A- or better.
Strong background in hands-on microfabrication techniques and with journal publications showing such evidences
At least 2 years’ or more experience in making and testing guided-wave based photonics devices
Possess 1 year or more relevant working experience in MEMS and Photonics design
Strong knowledge in L-Edit; Lumerical; CST; COMSOL; ANSYS;
Good written and verbal communications
Having more than 4 1st-authored international peer-reviewed journal papers (for RF)
Open to fixed term contract","$5,000","$3,800",Monthly,Non-executive,Research Fellow
237,1,Building and Construction,RYOBI GEOTECHNIQUE INTERNATIONAL PTE. LTD.,Permanent,Closing on 27 Feb 2019,West,Posted 28 Jan 2019,"1. Degree in Civil Engineering or other related engineering field. 
2. In-house training and guidance provided. 
3. Fresh or experienced graduate welcomed.","$3,800","$2,500",Monthly,Executive,Engineer
238,0,"Information Technology, Public / Civil Service",GOVERNMENT TECHNOLOGY AGENCY,Full Time,Closing on 27 Feb 2019,Full Time,Posted 28 Jan 2019,,"$15,000","$5,000",Monthly,Middle Management,Microsoft 365 Consultant
239,17,Advertising / Media,VF BRANDS PTE. LTD.,Full Time,Closing on 27 Feb 2019,North,Posted 28 Jan 2019,"~ Carry out acquisition and payment process.
~ Collate information for key word research, bit-bite and web statistics reporting.
~ Collate information on emerging technological changes.
~ Collate information on local and international business, market trends, new business opportunities and market segments.
~ Contribute to key work research and web statistics reporting.
~ Contribute to the development of the communication messages.
~ Coordinate media-related events.
~ Co-ordinate offline, online and social media marketing activities.
~ Follow intellectual property process for the use of licensed copyright materials.
~ Maintain internal communication platforms and channels.
~ Make logistical arrangements for public relations activities.
~ Monitor external communications platforms and channels.
~ Monitor social media platform.
~ Perform activities to implement data-driven insights.
~ Prepare and collate data used to perform data-mining.
~ Produce basic marketing materials.
~ Schedule public relations activities.
~ Source, acquire and manage stock images.
~ Support the analysis of data to generate insights.","$6,000","$5,000",Monthly,Manager,Assistant Marketing Manager - Kipling
240,8,Human Resources,HYDROGEN CONSULTING SOLUTIONS PTE. LTD.,Contract,Closing on 27 Feb 2019,Central,Posted 28 Jan 2019,"Bachelor’s degree required
Minimum 5+ years’ experience in sourcing & recruitment, ideally from Agency recruitment with in-house experience.
Demonstrated success in use of social media such as LinkedIn, Facebook, Twitter to drive company branding as well as develop candidate pipelines
An advanced level knowledge of the sourcing component of recruiting
The knowledge and maturity to manage client relationships and act as an effective RB ambassador
Intermediate level competency-based interviewing and candidate assessment skills
Proven success in managing and sourcing a high volume of job requisitions at one time. (when there’s a peak)
Demonstrated ability to take ownership of the sourcing/pre-screening process and successfully manage challenging assignments.
Knowledge and past use of a web-based applicant tracking system, Taleo preferred.
Proven track record of successfully meeting key performance metrics","$9,000","$7,000",Monthly,Manager,Talent Acquisition Manager
241,0,"Information Technology, Public / Civil Service",GOVERNMENT TECHNOLOGY AGENCY,Full Time,Closing on 27 Feb 2019,Full Time,Posted 28 Jan 2019,,"$10,000","$5,000",Monthly,Middle Management,"Automation Engineer, ServiceNow"
242,3,Engineering,MPHASIS PTE LTD,Full Time,Closing on 27 Feb 2019,East,Posted 28 Jan 2019,"• Strong critical thinker with problem solving aptitude
• Good written and oral communication skills
 ","$7,000","$5,000",Monthly,Middle Management,Oracle PLSQL Developer
243,1,Manufacturing,TALENT TRADER GROUP PTE. LTD.,Full Time,Closing on 27 Feb 2019,East,Posted 28 Jan 2019,"Degree in Mechanical Engineering or equivalent
Minimum 5 years of experience in System Engineering
Able to read technical drawings, understand BOMs, and use a variety of precision testing and measuring Instruments
Possess strong troubleshooting and analytical skills
Excellent command in optical, mechanical, electrical, and software components
Interested candidates, please send your resume to belinda.goh@talenttradergroup.com 
  EA License: 13C6305
Reg. No.: R1333012
  For candidate who applied for the advertised position is deemed to have consented to us that we may collect, use or disclose your personal information for purpose in connection with the services provided by us.","$5,500","$4,000",Monthly,Executive,Manufacturing Design Engineer
244,0,Sales / Retail,SHG FINANCIAL SERVICES PTE. LTD.,Full Time,Closing on 27 Feb 2019,Central,Posted 28 Jan 2019,"GCE'O' Level
Retail sales experiece preferred","$2,000","$1,700",Monthly,Non-executive,Retail Executive
245,6,Marketing / Public Relations,KERRY CONSULTING PTE. LTD.,Permanent,Closing on 27 Feb 2019,Central,Posted 28 Jan 2019,"You will need to be a Degree holder with at least 6 years in FMCG experience, with a minimum of 4 years Trade Marketing experience at Manager level. To be successful in the role, you need to possess strong interpersonal, presentation and detailed planning skills and is able to demonstrate strong analytical skills, ability to review data, draw conclusions and translate learnings into actions.
To apply, please submit your resume (in MS Word format) to Alicia Chew, Registration No: R1435541 Licence No: 16S8060 at ai@kerryconsulting.com, quoting job title and reference number 15177.

We regret only shortlisted candidates will be notified.","$8,000","$6,000",Monthly,Manager,Trade Marketing Manager
246,36,Accounting / Auditing / Taxation,AGAPE CHILD CARE(CCK) PTE. LTD.,Permanent,Closing on 27 Feb 2019,South,Posted 28 Jan 2019,"Bachelor of Accountancy/Finance or ACCA with at least 10 years’ solid working experience
Highly motivated self-starter with positive mindset
Excellent analytical and problem-solving skills
Resourceful, meticulous, hands-on and resilient
Excellent communication and interpersonal skills
Able to work independently as well as collaborate with others
Technically competent with up-to-date knowledge of accounting standards and practices as well as tax regulations
Proficiency in financial modelling and MS Office",,,,Manager,ACCOUNTS & FINANCE MANAGER
247,1,Engineering,MPHASIS PTE LTD,Full Time,Closing on 27 Feb 2019,Central,Posted 28 Jan 2019,"Good communications and ability to present complex ideas in a concise manner targeted at all levels
Good Troubleshooting skills","$9,000","$6,000",Monthly,Middle Management,Java UI Developer
248,3,Engineering,DAIKIN AIRCONDITIONING (SINGAPORE) PTE. LTD.,"Permanent, Full Time",Closing on 27 Feb 2019,North,Posted 28 Jan 2019,"Diploma / Degree in Mechanical/Electrical Engineering or related discipline
Sales background (preferably in Chiller or HVAC) with knowledge in air-conditioning industry will be an added advantage
Customer oriented, results-focused and possess good communication skills
Computer literate, knowledge in Microsoft applications a must
Applicants with own car will be considered with priority
Candidates with a keen interest to develop a career in air-con industry are welcomed to apply
Applicant must be prepared for business travel to Asean-Oceania region when required.

If you are looking for challenges and have the qualities and experience to undertake this challenging opportunity, please click on the APPLY NOW button with your detailed resume stating your qualifications, experience, present and expected salaries, notice period.
  We regret that only shortlisted candidates will be notified. Thank you for applying.",,,,"Fresh/entry level, Executive, Junior Executive",Sales Engineer (Regional ACMV)
249,11,"Admin / Secretarial, Education and Training, Marketing / Public Relations",SIR MANASSEH MEYER INTERNATIONAL SCHOOL PTE. LTD.,"Permanent, Full Time",Closing on 27 Feb 2019,North,Posted 28 Jan 2019,"A. Qualifications and Experience
Hold a university degree in any discipline; however, those without a degree but with relevant experience and expertise may also apply
Minimum 2 – 3 years relevant work experience in marketing and/or admissions 
Experience working in an educational institution is an advantage
B. Knowledge, Understanding, Skills and Abilities
Proficient in ICT skills and use of Microsoft Office, GSuite, database and social media applications
Experience with Open Apply is an advantage
Excellent interpersonal and communication skills.
Excellent written communication skills, and the ability to connect quickly with prospective families via email, flyers, social media and other written material. 
Bring experience in public speaking, and an ease with presenting to groups up to 200 people. 
Enjoy interacting with children and families and have a keen interest in working with an international population. This is a public-facing role. 
Be a driven and energetic individual who thrives in a team environment. 
Ability to establish and maintain good professional relationships with all pupils, parents and colleagues
  C. Leadership/Personal Qualities
A team player respected by others
Responsible and meticulous. 
Good interpersonal and communication skills to interact with diverse nationalities and cultures. 
Excellent command of spoken and written English.
Interested applicants please email resume in word doc to: careers@smm.edu.sg
Only shortlisted candidates will be contacted.","$3,700","$3,000",Monthly,Junior Executive,Admissions and Marketing Officer
250,0,Information Technology,KIM ANN ENGINEERING PRIVATE LIMITED,"Permanent, Full Time",Closing on 27 Feb 2019,West,Posted 28 Jan 2019,"SQL, MS Office and VBA knowledge is a must
Diploma or Degree in IT / Computing / Computer Science or at least 3 years working experience in similar role
Ability to work independently including communicate with end users, troubleshooting issues and provide problem resolution.
Only Singaporean needs to apply
Working location : Joo Koon (within walking distance from Joo Koon MRT)
5 days work per week
Interested candidate please send your resumes with last drawn and expected salary to cheryllou@kimann.com",,,,Executive,System Engineer
251,2,Logistics / Supply Chain,KATOEN NATIE SINGAPORE (JURONG) PTE. LTD.,"Permanent, Full Time",Closing on 27 Feb 2019,West,Posted 28 Jan 2019,"NITEC holder are welcome
Handling products of 25kgs
12-hours rotating shift work
Working location is at Jurong Island
Transport pick-up/ drop-off at Boon Lay, Jurong East, Outram Park and Woodlands MRT
  Or call us to find out more:
6419 2553
6813 8625","$2,800","$1,400",Monthly,"Fresh/entry level, Non-executive",Packaging Operator (Jurong Island)
252,1,Information Technology,THE SUPREME HR ADVISORY PTE. LTD.,Full Time,Closing on 27 Feb 2019,Central,Posted 28 Jan 2019,"Dylan Then Reg No: R1878687
The Supreme HR Advisory Pte Ltd EA No: 14C7279
 ","$3,000","$2,000",Monthly,Junior Executive,IT Support [SQL / .NET]
253,4,Information Technology,THE TORONTO-DOMINION BANK,Full Time,Closing on 27 Feb 2019,Central,Posted 28 Jan 2019,"  Strong leadership skills, self-motivated, highly organized and able to multi-task in a fast paced, dynamic environment. 
Strong communication skills, both verbal and written, are essential in order to interact with other support groups, clients and vendors alike. 
Experience and a sound understanding of network environments (TCP/IP, Cisco routers/switches, Load Balancing, Firewalls, WiFi/Wireless, VOIP, etc.) including an excellent understanding of telecommunications concepts and telco connectivity. 
Proficiency in executing operational initiatives, be able to effectively work with other teams as required in order to deliver strongly.  This includes external third-party network vendors.
Experience with Vendor coordination and operational management relating to incidents, maintenance, ticket bridging, etc.
Ability to effectively management shift schedule preparations, shift work and offshore coordination
Demonstrated People Leadership experience and skills
Past audit related experience and controls knowledge as it applies to the network space
Shift schedule preparation skills and management of shift leads and teams
Important Skills:
Strong at process development and implementation including all ITIL processes at TD
Strong network background to help provide leadership to team for resolution and follow ups. This includes troubleshooting and problem determination skills relating to network platforms including Routing, switching, firewalls, load balancers, optical, WAN connections, QoS, WiFi, DNS/DHCP, etc.  Meticulously follow up to take across the finish line.
Must be strong at making necessary recommendations and following through with remediation follow-up's including Root cause analysis and Problem action item follow-up as needed. 
Skills to work and collaborate with remote employees and team members
Ability to constantly optimize processes and be able to take on new work and train the team to ensure smooth transition
VOIP Experience is a definite plus including ability to maintain voice related configs on network devices like routers and switches
 Specific Educational Requirements / Accreditations
   Technology Degree/Diploma or equivalent work experience
CCNA, CCNP, CCIE, Management and ITIL certifications are a definite asset to this position
Strong technology hands on experience in various latest network technologies will be a definite plus.","$9,000","$6,000",Monthly,Professional,IT network
254,3,Repair and Maintenance,THE SUPREME HR ADVISORY PTE. LTD.,Full Time,Closing on 27 Feb 2019,Central,Posted 28 Jan 2019,"Dylan Then Reg No: R1878687
The Supreme HR Advisory Pte Ltd EA No: 14C7279
 ","$2,400","$2,000",Monthly,Junior Executive,Aerospace Technician [Overhaul / Maintenance]
255,1,"Information Technology, Sales / Retail , Telecommunications",FCS CAREERS PTE. LTD.,"Permanent, Full Time",Closing on 27 Feb 2019,East,Posted 28 Jan 2019,"Requirements
Diploma in any discipline;
At least 2 years of experience in sales coordination or administration;
Organised and meticulous, with a keen eye for detail;
Responsible and reliable in getting tasks completed in a timely manner;
Able to work in a fast-paced environment;
Excellent interpersonal skills and ability to work well in a team;
Proficient in English;
PC-literate and able to use related technologies efficiently to perform tasks assigned.
Get in touch with us
If you’d like to explore this opportunity, please reach out to Cleon Tan (R1547199) at cleon@fcs-careers.com for a confidential discussion.
FCS CAREERS PTE LTD (EA 94C4359)","$2,500","$2,000",Monthly,Executive,Sales Support Representative
256,13,Banking and Finance,ALEXANDER MANN BPO SOLUTIONS (SINGAPORE) PTE. LTD.,Permanent,Closing on 27 Feb 2019,South,Posted 28 Jan 2019,"Reconciliation and analytical skills with an aptitude for problem solvin
 Ability to work under pressure and to tight deadlines.
Ability to work as part of a team
 Strong PC skills, particularly Excel
The ability to multi task.
Third level qualification or equivalent by experience
 A flexible approach to work
Strong communication skills
Desirable:
• Some Asset Services specific experience would be most desirable.
• Knowledge of Banking / Financial services industry.
• Knowledge of the Prime Broker business
• Experience in dealing with clients and queries","$7,700","$3,850",Monthly,Professional,Operations Senior Analyst
257,1,Professional Services,UPTECH CONSULTANCY PTE. LTD.,Permanent,Closing on 27 Feb 2019,West,Posted 28 Jan 2019,"Qualification & Field of Study - Bachelor degree / preferably master degree, either in information system, mechatronics, computer engineering, computer science or equivalent. Knowledge in domain knowledge such as manufacturing industry and mechanical would be preferred.
Min. Years of Experience - 0 to 1 year
Other Requirements (e.g. Skills, Competencies) - Skills on backend algorithm, database design and development, Web app solutions, GUI design and development, client-server networking, computer languages of  Python, Javascript, C, C++, Java.
Salary expectation S$3,500 to S$4,000.","$4,000","$3,500",Monthly,Professional,Software Engineer (Python)
258,3,"Engineering, Manufacturing, Repair and Maintenance, Telecommunications",OAKTREE CONSULTING,"Permanent, Full Time",Closing on 27 Feb 2019,Central,Posted 28 Jan 2019,"  Please submit resumes to john@oaktree.com.sg with the following details in MS Word format:
  - Position applying for
- Current remuneration
- Expected remuneration
- Notice period 
    John Goh Meng Chye 
EA License No : 06C4642
EA Reg No : R1102621
    We regret that only shortlisted candidates will be notified.
 ","$5,000","$4,000",Monthly,"Manager, Executive",Mechanical Engineer(Pro / E)
259,1,"Engineering, Information Technology, Manufacturing",OAKTREE CONSULTING,"Permanent, Full Time",Closing on 27 Feb 2019,Central,Posted 28 Jan 2019,"  Please submit resumes to john@oaktree.com.sg with the following details in MS Word format:
  - Position applying for
- Current remuneration
- Expected remuneration
- Notice period 
    John Goh Meng Chye 
EA License No : 06C4642
EA Reg No : R1102621
    We regret that only shortlisted candidates will be notified.
 ","$4,500","$4,000",Monthly,"Manager, Executive",Supplier Quality Engineer(IPC Certification)
260,1,Engineering,VIBRO HOLDINGS PTE LTD,"Permanent, Full Time",Closing on 27 Feb 2019,Islandwide,Posted 28 Jan 2019,"- Degree/ Diploma in Mechnical/ Electrical Engineering or equivalent
- Ability to work under pressure and meet tight deadlines to ensure all quotations are delivered on time
-Ability to work as individual as well as team-player
-Preferably 1-2 years of local working experiences and have good contact with local and M&E industries
-Fresh Graduates/ Entry levels are welcome to apply as Trainings will be provided","$3,000","$2,500",Monthly,Fresh/entry level,Electrical Engineer (General)
261,3,Information Technology,CAPGEMINI SINGAPORE PTE. LTD.,"Permanent, Contract",Closing on 27 Feb 2019,Central,Posted 28 Jan 2019,"•7+ years of on experience with SAP BW/BI reporting and 10+ years of overall IT experience.
•2+ years of experience in SAP BW on HANA / B4HANA
•Strong experience with SAP BW platform, interfaces to BW platform, standard SAP extractors for BW, reporting on BW platform. 
•Strong experience in SAP Business Objects with knowledge of Webi, Analysis for Office, Dashboard
•Good understanding of SAP HANA Studio/Eclipse
•Strong experience of project lifecycle management and buisness communication 
•Should have an understanding of SAP core Finance, Human Resources, Procure-to-Pay modules to facilitate extraction of data
•Experienced in 3 full lifecycle SAP implementations
•Bachelor’s Degree or a combination of education and equivalent experience","$11,000","$8,000",Monthly,Professional,SAP BW Consultant
262,2,Engineering,VIBRO HOLDINGS PTE LTD,"Permanent, Full Time",Closing on 27 Feb 2019,Islandwide,Posted 28 Jan 2019,"- Degree/ Diploma in Mechnical/ Electrical Engineering or equivalent
- Ability to work under pressure and meet tight deadlines to ensure all quotations are delivered on time
- Ability to work as individual as well as team player
- Preferably 1- 2 years of local working experiences and have good contact with the local and M&E industries
- Fresh Graduates/ Entry levels are welcome as training will be provided","$3,000","$2,500",Monthly,Fresh/entry level,Mechnical engineer
263,5,Accounting / Auditing / Taxation,CIMB BANK BERHAD,Permanent,Closing on 27 Feb 2019,Central,Posted 28 Jan 2019,"A Bachelor's degree in Accounting / Finance / Business, or Chartered Accountant
Relevant experience in MAS regulatory reporting, e.g.: MAS 610, MAS 649 MAS 639, preferably with both banking and Big 4 audit experience
Ability to lead a team and drive initiatives and change with a structured and focused approach
Good team and stakeholder management skills
Strong analytical skills with an eye for detail
Proactive and self-driven
Please send your detailed resume, salary expectation, availability, and contact details to:
sg.enquiries@cimb.com","$11,000","$7,000",Monthly,Middle Management,"Vice President / Assistant Vice President, Finance (Regulatory Reporting)"
264,44,Banking and Finance,GOOGLE ASIA PACIFIC PTE. LTD.,Full Time,Closing on 27 Feb 2019,South,Posted 28 Jan 2019,"Minimum qualifications:
- Bachelor's degree in Computer Science, Math or related quantitative field or equivalent practical experience.
- Hands-on experience with quantitative analysis/modeling (e.g. scenario-based, sensitivity analyses, statistical techniques) and tools including Sql, R, SPSS, Python, MATLAB or similar.
- Fintech/payments experience working with acquirers or card networks or payments companies.
Preferred qualifications:
- Experience building business models from scratch.
- Developed business judgment and ability to communicate with a senior management team.
- Ability to self-direct work in an unstructured environment.","$27,500","$13,750",Monthly,Senior Executive,"Finance Manager, Google Pay - Singapore"
265,0,Information Technology,IT RIDERS PTE. LTD.,Full Time,Closing on 27 Feb 2019,Central,Posted 28 Jan 2019,"Responsibilities
 Network Consulting Engineer shall undergo on-boarding process to familiarize practices and culture. Vendor trainings are regularly organised and tracked.
Internal and Customer Kick off meetings
Data Gathering 
Low Level Design and signoff
Nail down configurations
Staging and Burn in Tests
Upgrades and Simulations
Racking and Installations
Configurations and Optimizations
User Trainings
Vendor Trainings for Engineers
Asbuilt Documentations and signoff
SAT, UAT Acceptance Tests and signoff
Handover to Customer & GNC
Qualifications
Possess a Diploma/Degree in Computer Science/Information Technology or equivalent with minimum 3 years of experience in network design/deployment.
Excellent knowledge in Routing and switching, eg. BGP, OSPF, Multicast, VSS, spanning tree, MPLS L3VPN. 
Good knowledge of Firewall technologies eg. IPSEC VPN, SSL VPN, IPS/IDS, Cisco ASA, Firepower, Fortigate and network access control(NAC) product, eg Aruba Clearpass Policy Manager, Cisco ISE. 
Experience in wireless setup eg. Cisco WLC, Aruba, Data centre technologies, eg. Cisco Nexus VDC, VPC, FEX, VXLAN, ACI.
Possess excellent interpersonal & communication skills 
Current CCNA/CCNP/ ACCP qualified with related professional experience, CCIE would be an advantage.
 ","$6,000","$4,500",Monthly,Non-executive,Network Consulting Engineer
266,1,Engineering,VIBRO HOLDINGS PTE LTD,Full Time,Closing on 27 Feb 2019,Islandwide,Posted 28 Jan 2019,"-Degree/ Diploma in Mechnical/ Electrical Engineering or equivalent
- Ability to work under pressure and meet tight deadlines to ensure all quotations are delivered on time
- Ability to work as individual as well as team-player
- Preferably 1-2 years of local working experiences and have good contact with the local and M&E industries
- Fresh Graduates/Entry levels are welcome as Training will be provided
-","$3,000","$2,500",Monthly,Fresh/entry level,Application Engineer
