,Applications,Categories,Company,EmployType,ExpiryDate,Location,PostedDate,Requirements,SalaryHigh,SalaryLow,SalaryRate,Seniority,Title
0,2,Information Technology,LEAP (G) PTE. LTD.,Permanent,Closing on 28 Feb 2019,Islandwide,Posted 29 Jan 2019,"Formal Education
Required: Bachelor’s degree in Computer Science or related field
Preferred: Master’s degree in Computer Science or related field, or similar postgraduate qualification
Required: Professional certification & knowledge in at least two of TOGAF, ITIL, CBCP, Project Management
Preferred: Intermediate knowledge of Cloud Computing with certification from at least one of AWS, GCP, Azure
Specialist Knowledge (Work Experience, Further Qualification)
10y+ of technical delivery and leadership experience gained from complex transition and transformation delivery projects, including: cloud, cloud migration plus two of server, virtualisation, database, applications or network
5y+ of project management experience gained from complex T&T delivery projects
Expert-level detail design for one of IaaS, PaaS or SaaS, with pre- and post-sales experience plus certification.
Intermediate-level detail design for two of IaaS, PaaS or SaaS solutions
Intermediate-level knowledge of techniques for technical project planning, scoping & program management
Intermediate-level knowledge on Cybersecurity, Business Continuity and Disaster Recovery Management
Hands-on delivery experience of large IaaS, PaaS and/or SaaS projects in the range of $1m p.a. and above
Hands on experience of conducting due diligence, leading from initial engagement to large, transformational deals supporting pre-sales and the account team
Experience of working APAC customers including Singapore, Indonesia, Australia, HK, Korea, Philippines, India
Able to scope and deliver estimation for physical, virtual and mixed projects.
Able to assist in proposal writing, including proactive proposals and RFI/RFP responses
Experience as team player with potential to lead in a demanding and high growth business
Key team member in a high growth business in APAC that has scaled greater than US$100m
Excellent written, verbal and interpersonal communication skills in a diverse and multicultural environment.
The position requires a good level of team-work and the ability to relate well with Customers and Partners","$15,000","$10,000",Monthly,Professional,Delivery Consultant
1,0,Sciences / Laboratory / R&D,A*STAR RESEARCH ENTITIES,"Contract, Full Time",Closing on 27 Feb 2019,South,Posted 29 Jan 2019,"Strong programming skills.
Expertise in mathematics, computer science, statistics, engineering, machine learning, signal processing, computational genomics, or a related field.
General quantitative intuition.
Strong publication record (postdoctoral candidates).
Strong communication skills.
The ability to work closely with clinicians and experimental biologists.
  The above eligibility criteria are not exhaustive. A*STAR may include additional selection criteria based
on its prevailing recruitment policies. These policies may be amended from time to time without notice.
  * We regret that only shortlisted candidates will be notified.","$9,000","$4,500",Monthly,Non-executive,GIS - Post Doctoral Fellows (Spatial Transcriptomics & Single Cell Oncology Program)
2,14,Accounting / Auditing / Taxation,BIG - FOOT LOGISTIC PTE LTD,Full Time,Closing on 28 Feb 2019,West,Posted 29 Jan 2019,"Min. LCCI Diploma
3 – 5 year of accounting experience
Exceptional time management skills.
Familiarity with basic Accounting principles.
Professional manner and strong ethical code.
Ability to multitask and remain motivated and positive.
Commitment to working efficiently and accurately.",,,,Junior Executive,Account Assistant
3,50,Sciences / Laboratory / R&D,SETSCO SERVICES PTE LTD,Full Time,Closing on 28 Feb 2019,West,Posted 29 Jan 2019,"Minimum Degree in Chemistry or any related field
Strong analytical background in chemical or any related field
Possess good management and interpersonal skills
Hands-on experience in analytical instruments' operation, maintenance and troubleshooting is advantageous
Able to work independently as well as in a team","$3,100","$2,400",Monthly,"Fresh/entry level, Executive",Assistant Chemist / Chemist
4,4,Information Technology,COMPANY UNDISCLOSED,Full Time,Closing on 28 Feb 2019,Central,Posted 29 Jan 2019,"1. Polytechnics Diploma / Bachelor Degree In Computer Engineering or Equivalence
2. CISCO CCNA and CCNP qualification would be an added advantage
3. 5 years or more network engineering in an MNC environment
4. Familiar with LAN & WAN Topologies and concepts on architectural & design level
5. Hands on experience configuring routers,switches,wireless access points
6. Familiar with the concepts of ITIL processes,incident and change management
7. Positive atitude towards changes,incidents,troubleshooting,eager to learn,highly analytical
8. Ability to document,maintain and create site level architectural networking diagrams, exhibit an attention to details.
 ","$6,000","$4,500",Monthly,Manager,Network Engineer / Manager
5,3,Information Technology,NIOMETRICS (PTE.) LTD.,Full Time,Closing on 28 Feb 2019,East,Posted 29 Jan 2019,"WHAT WE VALUE
Bachelor’s or Higher Degree in Computer Science or equivalent
Software craftsmanship
Experience with large C code bases and high-performance C programming
Familiarity with Intel’s DPDK toolkit
Familiarity with network protocols and tools such as Wireshark
Familiarity with shared memory data structures and parallel algorithms
Proficiency with Linux system & development tools","$11,000","$5,000",Monthly,Professional,High-Perfomance DPI Engineer
6,5,Information Technology,NIOMETRICS (PTE.) LTD.,Permanent,Closing on 28 Feb 2019,East,Posted 29 Jan 2019,"WHAT WE VALUE
Bachelor Degree in Computer Science or Software Engineering
Minimum 5 years experience with JavaScript, as well as Data Visualisation and charting
Ability to code custom functionality from scratch (without external libraries)
Good knowledge of the React framework","$10,000","$5,000",Monthly,Professional,UX / UI Developer
7,37,Logistics / Supply Chain,AMAZON ASIA-PACIFIC HOLDINGS PRIVATE LIMITED,Full Time,Closing on 28 Feb 2019,Central,Posted 29 Jan 2019,"Basic qualifications
· Bachelor’s degree in Supply Chain Management, Engineering, or other technical field from an accredited university or 5+ years experience
· Familiarity with Supply Chain Management concepts, e.g., forecasting, planning, optimization, and logistics
· Advanced knowledge of Excel is required
· Excellent written and verbal communication skills complemented with the ability to problem solve independently
· 3 - 5 years of work experience with the design and use of complex supply chain software systems
Preferred Qualifications
MBA and work experience in a Supply Chain field is highly desired

A successful candidate will also demonstrate:

· High attention to detail including proven ability to manage multiple, competing priorities simultaneously
· Data driven decision making mentality and sound business judgment
· Ability to think strategically and execute methodically
· Ability to work in a fast-paced environment where continuous innovation is desired
· Committed to learning and expanding professional and technical knowledge
· Demonstrated analytical and quantitative skills and ability to use hard data and metrics to back up assumptions and develop business cases
· Ability to clearly communicate data insights to others
· Willingness to roll up your sleeves and do whatever is necessary; general manager / owner mentality
· Demonstrated ability to dive deep in understanding the product, our business, and the competitive landscape
· Start-up attitude and ability to flex to help identify and solve quickly emerging opportunities",,,,Manager,"Senior Program Manager, Supply Chain"
8,4,Information Technology,AEA INTERNATIONAL HOLDINGS PTE. LTD.,"Permanent, Full Time",Closing on 28 Feb 2019,East,Posted 29 Jan 2019,"C. Job Profile
Required Skills and Knowledge
Experience in providing IT support  to the business
Hands on skill on Microsoft Windows-based OS workstation/server and MS office suite (e.g. Outlook, exchange, office etc)
Hands on skill on Microsoft Active Directory administration.
Knowledge on LAN networking, VPN, TCP/IP MS SQL Client/Server and Internet concepts and techniques.
Microsoft MCTS/MCITP/MCDST/MCSA certified an advantage.
ITIL foundation or equivalent certifications (preferred)
Expose to co-ordination activities during Major Incident process
Required Competencies
Must possess high service quality mindset and excellent communication skill across all levels; Customers/Users’ communication is a must to understand their requirements, concerns and areas of improvement in service quality.
Highly motivated - self starter
Must be self-motivated and a hands-on person with experience in Microsoft systems and office applications.
Experience in a multi-cultural environment, able to understand and accept the differences between cultures.
Ability to interact effectively with other technical and non-technical resources in a team environment.
Customer Service Oriented and ability to quickly establish comfortable & effective working relationships.
Strong oral and written technical and interpersonal communication skills including sensitivity to diverse global work culture and community.
Excellent organizational skills
Demonstrated ability to analyze and evaluate complex data and follow problem through till resolution
Ability to manage multiple tasks at one time
Ability to solve problem remotely and meet deadlines
Management of a  small team (< 10 members)
Attention to details
Required Work Experience
5 to 7 years experience in IT service desk environment with the last 2 years as a team supervisor/manager or similar capacity.
Min. 3 years experience working directly with internal/external clients.
Min. 1-2 years experience providing user support of client applications, PC/Windows network infrastructure, and custom business applications.
Experience with Microsoft OS, MS Exchange, MS Office, Active Directory, Network connectivity and VPN.
Experience in call/technical helpdesk environment providing remote support will be advantage
Required Qualifications
Bachelor Degree or Diploma in Computer Science/Engineering or equivalent experience.
Required Languages
English (high proficiency in spoken & written), any proficient 2nd language
Travel / Rotation Requirements
Work on a Shift Roster","$6,000","$5,000",Monthly,Professional,"Assistant Manager, Service Desk"
9,14,"Education and Training, Information Technology",CURTIN EDUCATION CENTRE PTE. LTD.,"Permanent, Full Time",Closing on 28 Feb 2019,Central,Posted 29 Jan 2019,"Qualifications and selection criteria:

Essential:
Demonstrated ability to meet deadlines and deal with competing priorities.
Excellent attention to detail, including proofreading and editing skills.
Demonstrated ability to relate well to students and professionals.
Ability to independently resolve routine problems and issues.
Sense of responsibility and commitment to education.
IT literacy (e.g. student information system or database, or customer relationship management systems) and experience.
Excellent communication skills 
Desirable:
Degree or equivalent (preferred).
Work experience in higher education sector, preferably in a commercial setting.","$2,800","$2,000",Monthly,Executive,Student and Academic Services Officer - Attendance
10,4,Consulting,LIBERTY WIRELESS PTE. LTD.,Full Time,Closing on 28 Feb 2019,South,Posted 29 Jan 2019,"At least 4 year experience working in a product or business development role in a Technology or E-Commerce firm.
Bachelor's degree in any discipline, MBA is a plus
Familiarity with the Telecommunication and/or Internet sectors
Can-do attitude, self-starter and proven track record in driving process and operational improvements 
Proven strategies in scaling up communities (50% in 3 months), reduce lead time in operational process(25%, streamling business streams to achieve efficiency. 
A large part of this project will be focused on dealing with Indonesia regulatory and translation, as such candidates with proficiency in Bahasa Indonesia will be preferred.
Able to develop relationships with CXO, board members as well as key stakeholders
Good communication skills with deep knowledge of local customs and culture  
Ability to learn quickly and adapt","$6,500","$4,500",Monthly,Manager,International Expansion Project Manager
11,2,Information Technology,INFINITE COMPUTER SOLUTIONS PTE LTD,Permanent,Closing on 28 Feb 2019,East,Posted 29 Jan 2019,"Qualifications and Education Requirements
Degree/Diploma in IT/Computer Science
Preferred Skills
10 years of production support experience as Linux Administrator.
experience in Red Hat Enterprise Linux, Debian and Ubuntu Installation,
HP Integrity and HP-9000 Platforms and HPUX 11.11, HPUX 11.23, HPUX 11.31 Installation, System Administration, Upgrades, Migration, Troubleshooting and Performance Management.
EA License No. - 14C6941","$7,500","$5,500",Monthly,Professional,System Administrator
12,0,Information Technology,INFINITE COMPUTER SOLUTIONS PTE LTD,"Permanent, Full Time",Closing on 28 Feb 2019,East,Posted 29 Jan 2019,"5 Year of experience in IBM Spectrum Protect (Tivoli Storage Managers) and other Backup Technologies.
Experince in TSM Implementation, TSM administration and configuration.
Qualifications and Education Requirements
·         Degree/Diploma in IT/Computer Science.
  EA License No. - 14C6941","$7,500","$5,500",Monthly,Professional,System Administrator
13,0,Information Technology,JONDAVIDSON PTE. LTD.,"Permanent, Contract, Full Time",Closing on 28 Feb 2019,East,Posted 29 Jan 2019,"•         6+ years’ experience of Test Automation Framework implementation and Framework types
•         Directing and coordinating the implementation of test automation and other test tools
•         Experience of TOSCA tool and framework
•         Experience in both Test design & Test automation using TOSCA
•         Experience in Service Virtualization and service automation. Knowledge of Selenium & also SV tools like CA Lisa is added advantage.","$9,000","$5,000",Monthly,Professional,Automation Architect (TOSCA)
14,3,Education and Training,BAKING INDUSTRY TRAINING COLLEGE PTE. LTD.,"Part Time, Permanent, Contract, Freelance, Full Time",Closing on 28 Feb 2019,"South, Central",Posted 29 Jan 2019,"Qualifications:
Preferably Degree in Culinary Arts/ Pastry & Bakery or related fields
Advanced Certificate in Training and Assessment (ACTA) is required to teach WSQ programmes
WSQ Diploma in Adult Continuing and Education (DACE) will be an added advantage
Relevant Experience:
Minimum 5 years of experience in Asian or Western Cuisine or Pastry & Bakery
Personal Characteristics & Behaviours
Ability to build strong working relationships within the faculty team and management
Must value good teamwork
Possess good coaching skills and can provide the necessary support to students where needed 
HAs strong focus oncontinuous improvment
Ability to develop receipes and maintain receipe standards
Maintain daily discipline on schedules, meetings and the teaching environment
Have high standards of excellence and professionalism and behave in a manner consistent with PEI values to be role model
English is required.  Mandarin and other European language will be an advantage.","$5,000","$3,000",Monthly,Non-executive,Chef Instructor (Culinary ARts / Pastry & Bakery)
15,1,Education and Training,BAKING INDUSTRY TRAINING COLLEGE PTE. LTD.,"Contract, Full Time",Closing on 28 Feb 2019,"South, Central",Posted 29 Jan 2019,"Qualifications:
Preferably Degree in Culinary Arts / Pastry & Bakery or related field
Advanced Certificate in Training and Assessment (ACTA) is required to teach WSQ programmes
WSQ Diploma in Adult Continuing and Education (DACE) would be an added advantage
Relevant Experience:
Minimum 7 years of experience in Asianor Western Cuisine or Pastry & Bakery
Personal Characteristics & Behaviours:
Ability to build strong working relationships within the faculty team and management
Must value good teamwork
Possess good coaching skills and can provide the necessary support to students where needed
Has strong focus on continuous improvement
Ability to develop receipes and maintain receipe standards
Maintain daily discipline on schedules, meetings and the teaching environment
Have high standards of excellence and professionalism and behave in a manner consistent with the PEIs values to be role model
English is required.  Mandarin and other European languages will be an advantage.","$8,000","$5,000",Monthly,Non-executive,Senior Chef Instructor (Culinary Arts / Pastry and Bakery)
16,1,Education and Training,BAKING INDUSTRY TRAINING COLLEGE PTE. LTD.,"Part Time, Permanent, Contract, Freelance, Full Time",Closing on 28 Feb 2019,"South, Central",Posted 29 Jan 2019,"Qualifications:
Preferably Degree in Culinary Arts/ Pastry & Bakery or related fields
Advanced Certificate in Training and Assessment (ACTA) is required to teach WSQ programmes
WSQ Diploma in Adult Continuing and Education (DACE) will be an added advantage
Relevant Experience:
Minimum 5 years of experience in Asian or Western Cuisine or Pastry & Bakery
Personal Characteristics & Behaviours
Ability to build strong working relationships within the faculty team and management
Must value good teamwork
Possess good coaching skills and can provide the necessary support to students where needed 
HAs strong focus oncontinuous improvment
Ability to develop receipes and maintain receipe standards
Maintain daily discipline on schedules, meetings and the teaching environment
Have high standards of excellence and professionalism and behave in a manner consistent with PEI values to be role model
English is required.  Mandarin and other European language will be an advantage.","$5,000","$3,000",Monthly,Non-executive,Chef Instructor (Culinary ARts / Pastry & Bakery)
17,0,Education and Training,BAKING INDUSTRY TRAINING COLLEGE PTE. LTD.,"Contract, Full Time",Closing on 28 Feb 2019,"South, Central",Posted 29 Jan 2019,"Qualifications:
Preferably Degree in Culinary Arts / Pastry & Bakery or related field
Advanced Certificate in Training and Assessment (ACTA) is required to teach WSQ programmes
WSQ Diploma in Adult Continuing and Education (DACE) would be an added advantage
Relevant Experience:
Minimum 7 years of experience in Asianor Western Cuisine or Pastry & Bakery
Personal Characteristics & Behaviours:
Ability to build strong working relationships within the faculty team and management
Must value good teamwork
Possess good coaching skills and can provide the necessary support to students where needed
Has strong focus on continuous improvement
Ability to develop receipes and maintain receipe standards
Maintain daily discipline on schedules, meetings and the teaching environment
Have high standards of excellence and professionalism and behave in a manner consistent with the PEIs values to be role model
English is required.  Mandarin and other European languages will be an advantage.","$8,000","$5,000",Monthly,Non-executive,Senior Chef Instructor (Culinary Arts / Pastry and Bakery)
18,0,"Design, Events / Promotions",FYREFLYZ PTE. LTD.,"Contract, Internship",Closing on 28 Feb 2019,East,Posted 29 Jan 2019,"Requirements
Good command of the English language (Written and Spoken)
Basic knowledge in Microsoft Office
Able to communicate well over the phone
  General Responsibilities and Requirements
Willingness to learn
Resilient
Ability to solve problems creatively and effectively
Good interpersonal and communication skill
Good positive working attitude
Ensuring all tasks are fulfilled within the scheduled timeline or earlier
Internship programmes are available for 3-months, 6-months and 1 year.
  If you are interested, please send your resume to hr@fyreflyz.com.",$800,$600,Monthly,Fresh/entry level,Events Intern
19,3,"Accounting / Auditing / Taxation, Admin / Secretarial, Customer Service, Marketing / Public Relations",BAKING INDUSTRY TRAINING COLLEGE PTE. LTD.,Full Time,Closing on 28 Feb 2019,South,Posted 29 Jan 2019,"Education Qualification: Degree / Diploma / ITE / GCE 'O' Level / GCE 'N' Level
At least 2 years' experience in relevant field, preferably in Private Education Industry
Bilingual Spoken and Written
Able to handle stress and work as a team
Shows lots of initiative and hardworking
5.5 days week","$3,000","$1,600",Monthly,Executive,Administrative Support Officer
20,0,Building and Construction,INNOCOM TECHNOLOGIES PTE LTD,Full Time,Closing on 28 Feb 2019,East,Posted 29 Jan 2019,"Degree / Diploma in Engineering
Diploma in Virtual Design and Construction
Diploma in Construction Productivity
Combined experience: creating models in 3D/BIM roles/field engineering/ field surveying, field engineering and/or CAD on highway/heavy civil engineering construction projects
Familiar with a wide variety of BIM / VDC and also IDD workflow
Working knowledge of BCA Standards and industry best-practices for VDC/IDD workflow applications in the industry.
Minimum of 5 years modelling with various Revit modelling/design software and Autodesk Naviswork for Collaboration and Simulation
Working capability in document/data management, scheduling and MS Project tools (preference BIM 360 Digital Collaboration & Primavera software)","$5,000","$4,000",Monthly,Manager,BIM / VDC / IDD MANAGER
21,0,Repair and Maintenance,OAKTREE CONSULTING,Permanent,Closing on 28 Feb 2019,South,Posted 29 Jan 2019,"- NITEC/Higher NITEC/ Diploma in Digital/Electronics/Electrical Engineering or Mechatronics
- Hands on experience in troubleshooting of monochrome and color printers in a network environment is an advantage
- Own motorbike or own vehicle. 
Please send in your resume in MS Word format. 
Manimalah Suppiah, EA License No : 06C4642, EA Reg No : R1105598","$2,500","$1,500",Monthly,Fresh/entry level,Technician
22,3,Information Technology,APAR INNOSYS PTE. LTD.,Contract,Closing on 28 Feb 2019,Central,Posted 29 Jan 2019,"2+ years of relevant technical QA experience
2+ years web-based systems testing experience
Good Experience into Automation and Manual Testing.
Good experience on on API and Python  ","$7,500","$5,000",Monthly,Executive,Senior Tester
23,0,Banking and Finance,BLUECHIP PLATFORMS ASIA PTE. LTD.,Full Time,Closing on 28 Feb 2019,Central,Posted 29 Jan 2019,"**Apply here**
https://www.bluechipcareers-asia.com/jobDetails/4662/corporate-finance-specialist
For more Banking and Finance Jobs visit us at:
https://www.bluechipcareers-asia.com",,,,Manager,Corporate Finance Specialist
24,9,Real Estate / Property Management,CBRE PTE. LTD.,Permanent,Closing on 28 Feb 2019,Islandwide,Posted 29 Jan 2019,"EDUCATION and EXPERIENCE
Bachelor's degree from College or University in a technical area of study. Minimum six years of related experience and/or training. Prior experience in a supervisory position (direct report responsibilities) required if specific duties include direct report responsibilities.
COMMUNICATION SKILLS
Ability to comprehend, analyze, and interpret the most complex business documents.
Ability to respond effectively to the most sensitive issues. Ability to write reports, manuals, speeches and articles using distinctive style. Ability to make effective and persuasive presentations on complex topics to employees, clients, top management and/or public groups. Ability to motivate and negotiate effectively with key employees, top management, and client groups to take desired action.","$5,500","$3,500",Monthly,"Manager, Senior Executive",Assistant Project Manager (Office Fit-Out)
25,4,Real Estate / Property Management,CBRE PTE. LTD.,Permanent,Closing on 28 Feb 2019,Central,Posted 29 Jan 2019,"KEY REQUIREMENTS
Bachelor’s degree in Construction Management, Architecture, Engineering, Business or equivalent to appropriate 4-year college program.
At least five years’ project management or construction management experience, or any similar.
Must be detail-oriented, analytical and computer-literate with proven leadership skills.
Knowledge and understanding of construction practices and techniques; Title III of ADA, contract laws, project controls, FIDIC, and building support systems.
Proven record of providing excellent internal and external customer service
Excellent interpersonal skills and problem-solving ability.
Strong verbal/written communication skills in English.
Familiar with design, construction and supply-oriented contracts, such as, but not limited to, government contracts, FIDIC contracts, etc.
Occasional travelling required.","$12,000","$8,000",Monthly,"Middle Management, Manager",Account Program Manager
26,0,Information Technology,KRIS INFOTECH PTE. LTD.,Contract,Closing on 28 Feb 2019,Islandwide,Posted 29 Jan 2019,"Create software engineering strategies that help identify and mitigate risks
Participate and drive peer review of code and identify re-usable frameworks
Document and communicate development status in a timely manner including metric reporting
 ","$7,000","$5,500",Monthly,Non-executive,Application Developer C#
